{
  "version": 1,
  "schema": "schema/species-vocabulary.schema.json",
  "semantics": "Maintained mappings from an exact source-wiki character category to a singular species label. A mapping classifies only the performer-role credits present in that source category; it is never inferred from prose or a performer's other records.",
  "taxa": [
    {
      "key": "species:star-trek:ferengi",
      "label": "Ferengi",
      "franchise": "Star Trek",
      "source_category": "Ferengi",
      "source_url": "https://memory-alpha.fandom.com/wiki/Category:Ferengi"
    },
    {
      "key": "species:star-trek:klingon",
      "label": "Klingon",
      "franchise": "Star Trek",
      "source_category": "Klingons",
      "source_url": "https://memory-alpha.fandom.com/wiki/Category:Klingons"
    }
  ]
}
